{
  "slug": "whatif-delta-breakdown",
  "session_key": "2026-09-09-whatif-delta-breakdown",
  "status": "complete",
  "created_at": "2026-09-09T08:14:04Z",
  "updated_at": "2026-09-09T08:45:00Z",
  "work_type": "W4",
  "resume_hint": "Shipped. PathView.breakdown is last-point Δ; MTM and Δ tables order signed descending."
}
