{
  "slug": "harness-pin-and-viz",
  "session_key": "2026-09-01-harness-pin-and-viz",
  "status": "in_progress",
  "created_at": "2026-08-31T23:34:53Z",
  "updated_at": "2026-09-01T00:30:00Z",
  "work_type": "W1",
  "resume_hint": "Implementer done; eng_verify PASS. Verifier should flip feature_list passes and write ship_note.json. Do not git commit until the user agrees."
}
