{
  "slug": "architecture-page",
  "session_key": "2026-09-05-architecture-page",
  "status": "complete",
  "created_at": "2026-09-05T13:49:38Z",
  "updated_at": "2026-09-05T14:30:00Z",
  "work_type": "W4",
  "resume_hint": "Architecture page plus inspectable mermaid figures. Restart :8765 after pull."
}
