{
  "slug": "ib-portfolio-v1",
  "session_key": "2026-09-05-ib-portfolio-v1",
  "status": "complete",
  "created_at": "2026-09-05T00:45:36Z",
  "updated_at": "2026-09-05T02:30:00Z",
  "work_type": "W4",
  "resume_hint": "Restart the UI to see /portfolio; do not commit .local IB files. Ask before git commit."
}
