{
  "slug": "harness-viz-ux",
  "session_key": "2026-09-01-harness-viz-ux",
  "status": "in_progress",
  "created_at": "2026-09-01T06:12:01Z",
  "updated_at": "2026-09-01T08:00:00Z",
  "work_type": "W4",
  "resume_hint": "W4 UI shipped pending verifier (passes still false). Leftover is W1: labels/orchestrator writes/conventions in workflow_spec. Leave archive/catalog/* uncommitted."
}
