{
  "slug": "ui-nav-ia",
  "session_key": "2026-09-06-ui-nav-ia",
  "status": "in_progress",
  "created_at": "2026-09-06T10:37:37Z",
  "updated_at": "2026-09-07T12:00:00Z",
  "work_type": "W4",
  "resume_hint": "Implementer finished three slices. Verifier: pytest apps/analysis_web/tests + eng_verify; curl /analyze aria-current, two wrapped disclose pairs, skip-link, run_detail ticker_prefix crumb, calibration empty exit; then mark feature_list passes."
}
