{
  "slug": "investment-quality-waves",
  "session_key": "2026-08-22-investment-quality-waves",
  "status": "scaffolded",
  "created_at": "2026-08-22T13:56:41Z",
  "updated_at": "2026-08-22T13:56:41Z",
  "work_type": "W1",
  "resume_hint": "Read issue.json and implement the first feature with passes=false."
}
