{
  "slug": "ui-decision-blotter",
  "session_key": "2026-09-06-ui-decision-blotter",
  "status": "scaffolded",
  "created_at": "2026-09-06T10:37:38Z",
  "updated_at": "2026-09-06T10:37:38Z",
  "work_type": "W4",
  "resume_hint": "Read issue.json and implement the first feature with passes=false."
}
