{
  "slug": "ui-session-compare",
  "session_key": "2026-08-26-ui-session-compare",
  "status": "in_progress",
  "created_at": "2026-08-25T22:55:55Z",
  "updated_at": "2026-08-25T22:55:55Z",
  "work_type": "W4",
  "resume_hint": "Implementer done; eng_verify PASS. Verifier should flip passes after review. HTTP smoke: /, /compares, /compares/new, META run-detail compare form."
}
