{
  "slug": "runs-list-search",
  "session_key": "2026-08-22-runs-list-search",
  "status": "complete",
  "created_at": "2026-08-22T11:11:47Z",
  "updated_at": "2026-08-22T12:00:00Z",
  "work_type": "W4",
  "resume_hint": "Feature complete; commit only after user agreement. Old UI on :8765 will not show this until restarted."
}
