{
  "slug": "harness-2-18-street-y1",
  "session_key": "2026-08-23-harness-2-18-street-y1",
  "status": "scaffolded",
  "created_at": "2026-08-23T02:43:25Z",
  "updated_at": "2026-08-23T02:43:25Z",
  "work_type": "W1",
  "resume_hint": "Read issue.json and implement the first feature with passes=false."
}
